{
  "review_mode": "administrative",
  "worker_identity": "vokerg",
  "merge_controller_identity": "vokerg",
  "require_distinct_identities": false,
  "self_approval_allowed": false,
  "self_merge_allowed": false,
  "notes": "Workers and merge-controller actions currently authenticate as the same GitHub account. Review is administrative, not independent. A future independent mode requires distinct authenticated identities and repository enforcement."
}
